<?xml version="1.0" encoding="UTF-8" ?>
<rows xmlns:xsi="http://www.w3.org/2001/XMLSchema-instance"
    xsi:noNamespaceSchemaLocation="../schema/STUDENT_DATA.xsd">
    <ROW>
        <IDNUMBER>89its001</IDNUMBER>
        <REGISTRATION_DATE>2014-01-01</REGISTRATION_DATE>
        <COLLEGE_CODE>GRAD</COLLEGE_CODE>
        <YEAR_CLASS>1</YEAR_CLASS>
        <CURRIC_CODE></CURRIC_CODE>
        <KEYPAD_ID>00156543</KEYPAD_ID>
    </ROW>
    <ROW>
        <IDNUMBER>89its002</IDNUMBER>
        <REGISTRATION_DATE>2014-01-01</REGISTRATION_DATE>
        <COLLEGE_CODE>UCAC</COLLEGE_CODE>
        <YEAR_CLASS>3</YEAR_CLASS>
        <CURRIC_CODE></CURRIC_CODE>
        <KEYPAD_ID></KEYPAD_ID>
    </ROW>
    <ROW>
        <IDNUMBER>89its003</IDNUMBER>
        <REGISTRATION_DATE>2014-01-01</REGISTRATION_DATE>
        <COLLEGE_CODE>HSS</COLLEGE_CODE>
        <YEAR_CLASS>5</YEAR_CLASS>
        <CURRIC_CODE></CURRIC_CODE>
        <KEYPAD_ID>00156543</KEYPAD_ID>
    </ROW>
    <ROW>
        <IDNUMBER>89its004</IDNUMBER>
        <REGISTRATION_DATE>2014-01-01</REGISTRATION_DATE>
        <COLLEGE_CODE>MCOM</COLLEGE_CODE>
        <YEAR_CLASS>6</YEAR_CLASS>
        <CURRIC_CODE></CURRIC_CODE>
        <KEYPAD_ID>00156543</KEYPAD_ID>
    </ROW>
    <ROW>
        <IDNUMBER>89its005</IDNUMBER>
        <REGISTRATION_DATE>2014-01-01</REGISTRATION_DATE>
        <COLLEGE_CODE>ENGR</COLLEGE_CODE>
        <YEAR_CLASS>7</YEAR_CLASS>
        <CURRIC_CODE>MSYSC</CURRIC_CODE>
        <KEYPAD_ID>00156543</KEYPAD_ID>
    </ROW>
    <ROW>
        <IDNUMBER>89its006</IDNUMBER>
        <REGISTRATION_DATE>2014-01-01</REGISTRATION_DATE>
        <COLLEGE_CODE>HSE</COLLEGE_CODE>
        <YEAR_CLASS>4</YEAR_CLASS>
        <CURRIC_CODE>MSYSC</CURRIC_CODE>
        <KEYPAD_ID>00156543</KEYPAD_ID>
    </ROW>
</rows>
